"os","fecha_ingreso","cliente","descripcion_problema","trabajos_realizados"
"28791","2025-12-02 00:00:00","OXIDOM","EQUIPO TENIA PERDIDA DE FLUJO DE AIRE INTERNA - EQUIPO CONTAMINADO POR BICHOS EN SU INTERIOR - MAL FUNCIONAMIENTO DE RESLEX 
PERDIDA DE FLUJO INTERNA POR TURBINA DESACOMODADA","LIMPIEZA Y DESINFECCION DE EQUIPO - ACTUALIZACION DE SOFTWARE DEL EQUIPO - CONTROL OK
CAMBIO DE CARCAZA DE TURBINA POR RESIDUOS DE INSECTOS 
"
"28792","2025-12-02 00:00:00","OXIDOM","MAL FUNCIONAMIENTO DEL RESLEX - SILBIDO EN TURBINA","SE REALIZO ACTUALIZACION DE SOFTWARE PARA CORRECCION DE RESLEX - SILBIDO EN TURBINA CAUSADO POR RODAMIENTO INTERNO DE LA TURBINA DESGASTADO, CAUSADO POR EL EXCESO DE SUCIEDAD QUE ENTRO EN EL EQUIPO(SE ADJUNTAN FOTOS)
REQUIERE CAMBIO DE TURBINA"
"28809","2025-12-05 00:00:00","PRAXAIR ARG.","oscilación de presión por falla en reslex - equipo sucio","actualización de software  - limpieza interior y exterior - control de funcionamiento ok"
"28891","2025-12-15 00:00:00","BIOMEDICAL CARE SUR S.A.S.","microsd del equipo pide formatear por error de numero de serie - cuando se intento leer los datos de tarjeta en el software somnus tiro el error  ""La operación aritmética ha provocado un desbordamiento"" - equipo con bastante polvo y tierra en su interior","-El equipo pide formatear la microSD cuando se enciende porque esta línea de equipos solo permite una microSD por equipo, no permite usar la misma para diferentes equipos
-Se identificaron los archivos corruptos de la sd y se intercambiaron por otros que no lo estén, de otro equipo, haciendo esto se logro leer los datos de terapia en el somnus con el inconveniente de que a la hora de leer los datos, el numero de serie que figurara es el del equipo que se usaron los archivos - se enviara una carpeta comprimida con todos los datos óptimos para leerlos - se recomienda formatear la microSD y usarla nuevamente en el equipo que corresponde
-Limpieza interior y exterior de equipo, control de funcionamiento ok"
"28889","2025-12-16 00:00:00","SIED","NO DETECTA IMAN DE GOTERO","AJUSTE DE ALOJAMIENTO IMAN DE GOTERO, CONTROL DE FUNCIONAMIENTO"
"28912","2025-12-22 00:00:00","NOVAMED S.A.","","LIMPIEZA Y CONTROL DE FUNCIONAMIENTO"
"28931","2025-12-31 00:00:00","RESPIFLOW","devolucion","LIMPIEZA GRAL CONTROL DE FUNCIONAMIENTO"
